Filnavn;Gruppe;Undergruppe;Branche
Information på hjemmeside og Intranet.aspx;;;Beredskab
Startside.aspx;;;Beredskab
Forretningsgang for mindre skybrudsskader.aspx;;;Beredskab
Nedsættelse af følgegruppe til det videre forløb.aspx;;;Beredskab
Beskrivelse af Job 2.aspx;;;Beredskab
Statistik.aspx;;;Beredskab
Reassurance.aspx;;;Beredskab
Taksatorkorps og skadeservice.aspx;;;Beredskab
Tilretning og klargøring af telefonsystem.aspx;;;Beredskab
Følgende medarbejdere aktiveres til Job 2.aspx;;;Beredskab
Detaljerede instrukser til skadebehandlere.aspx;;;Beredskab
Kontaktoplysninger på ledere i Skadesektionen.aspx;;;Beredskab
Andet til følgegruppens overvejelse og det videre forløb.aspx;;;Beredskab
Beslutning om indsatsgruppe til færdiggørelse af skaderne.aspx;;;Beredskab
SP håndværkere ved skybrud og storm.aspx;;;Beredskab
Forhåndsaccept.aspx;;;Beredskab
Beslutning om aktivering af beredskabet.aspx;;;Beredskab
Information til eller indkaldelse af medarbejdere.aspx;;;Beredskab
